Date,Website,Title,URL,Author
2025-12-24T21:27:38Z,The New York Times,"A Million More Epstein Documents Have Been Found, Justice Dept. Says",https://www.nytimes.com/2025/12/24/us/politics/epstein-files-documents-doj.html,Devlin Barrett & Michael Gold
2025-12-24T19:49:00Z,The Atlantic,So This Is Why Trump Didn't Want to Release the Epstein Files,https://www.theatlantic.com/politics/2025/12/trump-epstein-files-justice-department-redactions/685455/,Sarah Fitzpatrick
2025-12-25T08:06:45Z,NPR,DOJ says it may need a 'few more weeks' to finish releasing Epstein files,https://www.npr.org/2025/12/25/g-s1-103685/doj-says-few-more-weeks-epstein-files,
2025-12-25T10:58:48Z,The New York Times,Heavy Rains and Floods Threaten California on Christmas Day,https://www.nytimes.com/2025/12/25/weather/rain-flooding-los-angeles-storm.html,Francesca Regalado
2025-12-25T09:01:00Z,ABC7 Los Angeles,Brunt of storm slams Inland Empire as heavy rain prompts evacuations and road closures across SoCal,https://abc7.com/live-updates/southern-california-weather-atmospheric-river-bring-storm-possible-flash-floods-region/18307242/,
2025-12-25T00:57:48Z,BBC,"Watch: Mudslides, flooding and debris - storms batter southern California",https://www.bbc.com/news/videos/c4gp7xx2x02o,
2025-12-22T10:00:00Z,Washington Monthly,The GOP War on Nurses,https://washingtonmonthly.com/2025/12/22/gop-war-on-nurses-graduate-student-loans-tax-cuts/,Paul Glastris
2025-12-23T20:09:00Z,Spectrum News,How excluding nursing from 'pro­fes­sional' degree status could affect student loans,https://spectrumlocalnews.com/nys/central-ny/news/2025/12/23/nursing-degree-redefined-,Shalon Stevens
2025-12-23T10:10:00Z,Business Insider,Trump is getting rid of a key student-loan program. Yale has a replacement.,https://www.businessinsider.com/trump-getting-rid-grad-plus-student-loans-borrowing-yale-replacement-2025-12,Ayelet Sheffey
2025-12-25T04:50:55Z,The New York Times,Kennedy Center's Christmas Eve Jazz Show Canceled After Trump Name Added to Building,https://www.nytimes.com/2025/12/24/us/kennedy-center-christmas-eve-concert-trump.html,Francesca Regalado
2025-12-25T01:21:00Z,CNN,Annual Christmas Eve jazz concert canceled after Trump's name installed on Kennedy Center,https://www.cnn.com/2025/12/24/politics/kennedy-center-christmas-eve-concert-trump,Aleena Fayaz
2025-12-24T13:00:00Z,The Hill,Trump's naming spree draws legal scrutiny,https://thehill.com/newsletters/the-gavel/5661607-trump-renames-institutions-legacy/,Ella Lee & Zach Schonfeld
2025-12-24T21:56:35Z,CNN,Trump-backed ex-mayor declared winner of Honduran presidential election,https://www.cnn.com/2025/12/24/americas/honduras-presidential-election-results-latam-intl,
2025-12-25T00:39:00Z,The Guardian,Trump-backed candidate Asfura declared new president of Honduras,https://www.theguardian.com/world/2025/dec/24/honduras-nasry-tito-asfura-declared-president-donald-trump-backed,Tiago Rogero
2025-12-24T21:53:49Z,U.S. Department of State (.gov),Congratulating Honduras' President-Elect Asfura's Electoral Victory,https://www.state.gov/releases/office-of-the-spokesperson/2025/12/statement-by-secretary-marco-rubio-congratulating-honduras-president-elect-asfuras-electoral-victory,Marco Rubio
2025-12-25T05:00:05Z,The New York Times,Why Russia Is Likely to Reject the New U.S.-Ukrainian Peace Plan,https://www.nytimes.com/2025/12/25/world/europe/russia-ukraine-peace-plan.html,Ivan Nechepurenko
2025-12-25T11:17:08Z,Reuters,"Russia is analysing US documents on Ukraine peace deal, Kremlin says",https://www.reuters.com/world/europe/russia-is-analysing-us-documents-ukraine-peace-deal-kremlin-says-2025-12-25/,"Dmitry Antonov, Guy Faulconbridge & Gleb Stolyarov"
2025-12-25T03:06:19Z,Institute for the Study of War,"Russian Offensive Campaign Assessment, December 24, 2025",https://understandingwar.org/research/russia-ukraine/russian-offensive-campaign-assessment-december-24-2025/,
2025-12-24T17:32:57Z,The New York Times,Trump's Seizures of Oil Tankers Challenge Maritime Rules and Customs,https://www.nytimes.com/2025/12/24/business/trump-venezuela-oil-tankers.html,Peter Eavis
2025-12-22T23:47:16Z,CNN,Trump says US remains in pursuit of oil tanker and it'd be 'smart' for Maduro to step down,https://www.cnn.com/2025/12/22/politics/oil-tanker-pursuit-trump-maduro,Donald Judd & Kevin Liptak
2025-12-24T01:19:22Z,Axios,"Trump on seized Venezuelan oil: ""We're gonna keep it""",https://www.axios.com/2025/12/23/trump-venezuela-oil-policy-keep,Marc Antony Caputo
2025-12-24T23:49:58Z,CNN,Trump tells 10-year-old child he made sure 'a bad Santa' is not 'infiltrating' the US,https://www.cnn.com/2025/12/24/politics/trump-santa-norad-calls,Kevin Liptak
2025-12-25T00:41:15Z,BBC,Where is Santa now? Trump answers kids' Christmas calls to Norad tracker,https://www.bbc.com/news/videos/cqxqvd0z5gno,
2025-12-25T01:49:00Z,NBC News,Trump adds 'clean coal' into holiday mix in Christmas Eve call with kids,https://www.nbcnews.com/politics/donald-trump/trump-clean-coal-norad-santa-tracker-calls-children-christmas-eve-rcna250897,
2025-12-23T21:03:02Z,6abc Philadelphia,"2 dead, 20 hospitalized after explosion at Bucks County, Pennsylvania nursing home",https://6abc.com/post/explosion-reported-nursing-home-bucks-county-reports-people-trapped/18309877/,
2025-12-23T20:22:33Z,NBC10 Philadelphia,"Multiple people hurt in explosion at nursing home in Bucks County, Pa.",https://www.nbcphiladelphia.com/news/local/emergency-crews-respond-to-reported-explosion-at-nursing-home-in-bucks-county/4321989/,David Chang
2025-12-24T20:33:55Z,ABC News,"1 nursing home resident, 1 employee killed in fire, explosion; cause under investigation",https://abcnews.go.com/US/1-nursing-home-resident-1-employee-killed-fire/story?id=128680113,Emily Shapiro
2025-12-24T15:02:11Z,The New York Times,They Seek to Curb Online Hate. The U.S. Accuses Them of Censorship.,https://www.nytimes.com/2025/12/24/business/europe-us-online-censorship-free-speech.html,Adam Satariano
2025-12-25T03:28:28Z,The Guardian,"Trump news at a glance: EU could respond to 'unjustified' US visa bans, official says",https://www.theguardian.com/us-news/2025/dec/25/trump-administration-news-updates-today-latest,
2025-12-24T13:51:45Z,NBC News,Europe pushes back at Trump's 'authoritarian' sanctions on anti-disinformation figures,https://www.nbcnews.com/world/europe/europeans-push-back-trumps-authoritarian-sanctions-anti-disinformation-rcna250791,
2025-12-24T17:37:00Z,CNN,Suspect in National Guard shooting faces new federal charges that allow death penalty discussions,https://www.cnn.com/2025/12/24/us/national-guard-shooting-suspect-death-penalty,
2025-12-24T02:51:09Z,Department of Justice (.gov),New Federal Charges in Killing of National Guardsman Sarah Beckstrom and Shooting of Guardsman Andrew Wolfe,https://www.justice.gov/usao-dc/pr/suspect-killing-national-guardsman-sarah-beckstrom-charged-complaint-new-federal-counts,
2025-12-24T13:17:07Z,The Washington Post,National Guard slaying case moves to federal court,https://www.washingtonpost.com/dc-md-va/2025/12/24/beckstrom-guard-killing-death-penalty/,Martin Weill
2025-12-24T18:07:16Z,The New York Times,How a Scholar Nudged the Supreme Court Toward Its Troop Deployment Ruling,https://www.nytimes.com/2025/12/24/us/politics/georgetown-scholar-supreme-court.html,Adam Liptak
2025-12-24T11:00:59Z,CNN,Supreme Court's National Guard decision could force new debate over how Trump could use Insurrection Act,https://www.cnn.com/2025/12/24/politics/national-guard-trump-insurrection-act-supreme-court,John Fritze
2025-12-25T02:10:48Z,The Washington Post,Opinion | The Supreme Court raises the stakes on Trump's troop deployments,https://www.washingtonpost.com/opinions/2025/12/24/supreme-court-trump-chicago/,
2025-12-24T04:34:04Z,The New York Times,19 States Sue to Block White House Plan to End Gender-Related Care for Minors,https://www.nytimes.com/2025/12/23/us/states-lawsuit-kennedy-gender-care-hospitals.html,Orlando Mayorquin & Chris Hippensteel
2025-12-24T16:35:48Z,CNN,Democratic-led states sue HHS over proposal targeting hospitals that offer transgender care to minors,https://www.cnn.com/2025/12/24/politics/democratic-led-states-sue-hhs-transgender-care,Tierney Sneed
2025-12-24T18:19:00Z,Milwaukee Journal Sentinel,Wisconsin sues Trump over rules restricting gender-affirming care,https://www.jsonline.com/story/news/health/2025/12/24/wisconsin-joins-multistate-lawsuit-challenging-youth-gender-care-limits/87906650007/,Natalie Eilbert
2025-12-23T21:53:50Z,The Seattle Times,Ferguson backs seismic shift in WA's tax code,https://www.seattletimes.com/seattle-news/politics/ferguson-backs-wa-income-tax-on-millionaires/,"Brunner, Jim"
2025-12-24T16:42:00Z,Fortune,Millionaire tax plans spread as Washington state eyes new levy,https://fortune.com/2025/12/24/millionaire-tax-plans-spread-as-washington-state-eyes-new-levy/,
2025-12-22T13:00:00Z,The Olympian,Here are some top issues we're watching ahead of WA's 2026 legislative session,https://www.theolympian.com/news/politics-government/article313666180.html,Simone Carter
2025-12-24T13:03:37Z,6abc Philadelphia,Delaware state police trooper killed in shooting at DMV facility in New Castle County,https://6abc.com/post/active-shooter-reported-dmv-wilmington-delaware/18309833/,Leland Pinder
2025-12-25T10:37:00Z,The News Journal,"An 'American dream.' Wrestling teammates, coaches remember Tyler Snook",https://www.wdel.com/news/police-identify-trooper-killed-in-line-of-duty-at-wilmington-dmv/article_fb2a8151-a89c-4cac-8069-7cb4d3e8daef.html,Brandon Holveck
2025-12-24T18:52:00Z,WDEL,Police identify trooper killed in line-of-duty at Wilmington DMV,https://washingtonstatestandard.com/2025/12/23/ferguson-calls-for-tapping-reserve-fund-and-climate-law-cash-to-fill-wa-budget-hole/,"Mark Fowser, Mike Phillips & Sean Greene"
2025-12-23T20:30:00Z,king5.com,"Gov. Ferguson's proposed budget includes further cuts to state agencies, higher education",https://www.king5.com/article/news/politics/gov-fergusons-proposed-budget-includes-further-cuts-to-state-agencies-higher-education/281-3e22dc6d-6bf0-4a58-93b9-6f8aac0916a6,Helen Smith
2025-12-23T23:18:11Z,The Seattle Times,WA schools Superintendent Reykdal criticizes Ferguson's proposed cuts,https://www.seattletimes.com/education-lab/wa-schools-superintendent-reykdal-criticizes-fergusons-proposed-cuts/,Claire Withycombe
2025-12-24T00:05:37Z,Office of Financial Management (.gov),Strategic Priorities,https://ofm.wa.gov/budget/state-budget-2025-27/26-proposed-supplemental/budget-highlights/strategic-priorities/,
2025-12-24T21:27:00Z,The New York Times,Judge Blocks Conditions Imposed on States Seeking FEMA Grants,https://www.nytimes.com/2025/12/23/us/politics/trump-fema-grants-states-population.html,Scott Dance
2025-12-24T17:17:00Z,The Guardian,Federal judge blocks White House's reductions of homeland security funding to states,https://www.theguardian.com/us-news/2025/dec/24/federal-judge-white-house-state-homeland-security-funding,Gloria Oladipo
2025-12-24T14:08:32Z,CNN,Federal judge says Trump administration must restore disaster money to Democratic states,https://www.cnn.com/2025/12/24/politics/trump-administration-disaster-money-democratic-states,
2025-12-24T21:35:00Z,Inquirer.com,Crowds flocked to the final Wanamaker Light Show of the season. No one knows when it's coming back,https://www.inquirer.com/news/wanamaker-light-show-final-show-season-20251224.html,Mike Newall
2025-12-24T02:31:15Z,CBS News,Crowds pack Philadelphia's Wanamaker Building for final Christmas Light Shows amid uncertain future,https://www.cbsnews.com/philadelphia/news/wanamaker-christmas-light-show-dickens-village/,Ross Dimattei
2025-12-17T10:36:09Z,WHYY,Fans wrap around the block for the last days of Philly's Wanamaker Light Show,https://whyy.org/articles/philadelphia-wanamaker-light-show-christmas/,Peter Crimmins
2025-12-24T16:50:00Z,KPTV,There isn't going to be a Christmas Eve windstorm today,https://www.kptv.com/2025/12/24/there-isnt-going-be-christmas-eve-windstorm-today/,Mark Nelsen
2025-12-23T01:18:00Z,KGW,Christmas Eve forecast shows weakening winds across Portland metro area | Weather Impact Alert,https://www.kgw.com/article/weather/weather-impact/weather-impact-alert-portland-eve-strong-winds-christmas-eve/283-3341574f-0d52-4da0-ab05-29e2b255f165,Luisa Anderson
2025-12-24T03:31:48Z,Statesman Journal,Update: Windstorm hitting Oregon Christmas Eve downgraded,https://www.statesmanjournal.com/story/news/local/oregon/2025/12/23/winds-forecast-to-slam-oregon-christmas-eve-updated-forecast/87900110007/,Zach Urness
2025-12-24T11:51:29Z,NewsNation,Mother faces murder charge after Melodee Buzzard found dead,https://www.newsnationnow.com/missing/major-development-expected-melodee-buzzard-case/,
2025-12-25T04:03:20Z,The Washington Post,Mother charged in 'cold-blooded' killing of 9-year-old daughter,https://www.washingtonpost.com/nation/2025/12/24/california-girl-melodee-buzzard-killing-utah/,Jennifer Hassan & Karin Brulliard
2025-12-24T15:16:14Z,BBC,Mother arrested after body of missing nine-year-old girl found,https://www.bbc.com/news/articles/cn4dkjwg031o,Ana Faguy
2025-12-24T20:54:38Z,The Seattle Times,A main WA ski resort is operating at full capacity after highway fixes,https://www.seattletimes.com/life/outdoors/crystal-mountain-resort-operating-at-full-capacity-after-highway-410-repairs/,Nicole Pasia
2025-12-23T01:58:58Z,FOX 13 Seattle,Repairs underway on WA's SR 410 after White River flooding washout,https://www.fox13seattle.com/news/sr-410-repairs-flooding-washout,Lauren Donovan
2025-12-24T17:52:03Z,KOMO,SR 410 towards Crystal Mountain fully reopens,https://komonews.com/news/local/sr-410-crystal-mountain-resort-reopens-wsdot-construction-flooding-water-road-highway-enumclaw,
2025-12-23T17:04:26Z,ABC News,Former Sen. Ben Sasse announces he has been diagnosed with advanced pancreatic cancer,https://www.nbcnews.com/world/venezuela/venezuela-seeks-criminalize-oil-tanker-seizures-trump-puts-pressure-ma-rcna250738,Oren Oppenheim
2025-12-23T16:08:00Z,WCJB,"'Death sentence': Former UF president, Sen. Ben Sasse shares stage-four pancreatic cancer diagnosis",https://abcnews.go.com/Politics/former-sen-ben-sasse-diagnosed-advanced-pancreatic-cancer/story?id=128653847,Ryan Turbeville
2025-12-23T16:08:35Z,The New York Times,"Ben Sasse, Former Nebraska Senator, Shares Terminal Pancreatic Cancer Diagnosis",https://www.nytimes.com/2025/12/23/us/politics/ben-sasse-pancreatic-cancer.html,"Adeel Hassan, Charles Homans & Stephanie Saul"
2025-12-25T00:05:01Z,The New York Times,"After a Plane Crashed in the Texas Fog, 2 Stories of Rescue",https://www.nytimes.com/2025/12/24/us/galveston-plane-crash-rescue-mexico-navy.html,Mark Walker
2025-12-24T00:23:21Z,KHOU,'Entirely preventable' | Veteran commercial pilot weighs in on deadly Galveston plane crash,https://www.khou.com/article/news/local/pilot-galveston-plane-crash/285-6cc31720-1b0c-4ad1-98ec-a22d3fbaec28,Marcelino Benito
2025-12-23T18:29:04Z,ABC13 Houston,"Galveston plane crash: Person missing after plane went down in water confirmed dead, bringing death toll 6, Mexican Navy says",https://abc13.com/post/galveston-plane-crash-search-efforts-continue-person-missing-went-down-water-killing-5-officials-say/18309417/,"Nick Natario, Brandon Hamilton & Sarah Al-Shaikh, M.S."
2025-12-20T22:21:00Z,Chicago Sun-Times,City Council sends alternate budget to Mayor Brandon Johnson - will he veto it?,https://chicago.suntimes.com/city-hall/2025/12/20/chicago-budget-veto-brandon-johnson-alternate-head-tax,Mariah Woelfel
2025-12-23T18:45:45Z,The Washington Post,Opinion | Chicago is in a bind. It needs more than short-term fixes to get out.,https://www.washingtonpost.com/opinions/2025/12/23/chicago-city-budget-brandon-johnson-alderman/,
2025-12-23T18:18:27Z,Block Club Chicago,"Mayor Won't Veto Council-Backed Budget, Avoiding City Shutdown",https://blockclubchicago.org/2025/12/23/mayor-wont-veto-council-backed-budget-avoiding-city-shutdown/,Quinn Myers
2025-12-23T22:40:49Z,Boulder Daily Camera,Colorado leaders mobilize bipartisan congressional coalition to protect NCAR,https://www.dailycamera.com/2025/12/23/congress-bipartisan-coalition-letter-ncar-neguse-trump/,Olivia Doak
2025-12-19T17:21:49Z,The New York Times,A Somber Mood at Science Meeting as Trump Budget Cuts Continue,https://www.nytimes.com/2025/12/19/climate/ncar-climate-research-agu.html,Eric Niiler
2025-12-20T22:40:18Z,Colorado Public Radio,"Hundreds protest Trump's move to dismantle NCAR, a premier climate and weather hub",https://www.cpr.org/2025/12/20/ncar-boulder-trump-dismantle-protest/,Ishan Thakore
2025-12-23T16:18:53Z,Mother Lode's News - myMotherLode.com,"CHP Wants Drivers To ""Brake"" Habit Of Speeding During Christmas HEP",https://mymotherlode.com/news/local/10333950/chp-wants-drivers-to-brake-habit-of-speeding-during-christmas-mep.html,Tracey Petersen
2025-12-22T23:44:04Z,KTLA,California DMV and CHP launch joint pilot program to curb speeding,https://ktla.com/news/california/california-dmv-and-chp-launch-joint-pilot-program-to-curb-speeding/,Iman Palm
2025-12-24T16:14:15Z,10News.com,CHP's Christmas enforcement campaign starts Wednesday evening,https://www.10news.com/news/local-news/chps-christmas-enforcement-campaign-starts-wednesday-evening-122425,
2025-12-24T18:54:58Z,Al Jazeera,Arab League welcomes Sudanese gov't peace plan presented at UN,https://www.aljazeera.com/news/2025/12/24/arab-league-welcomes-sudanese-govt-peace-plan-presented-at-un,
2025-12-22T22:10:40Z,UN News,UN warns Sudan war entering deadlier phase as fighting spreads in Kordofan,https://news.un.org/en/story/2025/12/1166655,Vibhu Mishra
2025-12-19T19:21:55Z,Reuters,Rubio says immediate US goal on Sudan is cessation of hostilities into new year,https://www.reuters.com/world/africa/rubio-says-immediate-goal-sudan-is-cessation-hostilities-going-into-new-year-2025-12-19/,
2025-12-24T11:35:56Z,Times Union,What does 6-7 mean? Here's why kids are saying it across the Capital Region and beyond,https://www.timesunion.com/educatiorticle/what-does-6-7-mean-why-kids-say-slang-term-21225242.php,Lilli Iannella
2025-12-23T01:45:34Z,local21news.com,The story behind the '6-7' cultural craze and how a Pennsylvania school embraced the trend,https://local21news.com/news/local/why-social-media-trends-have-such-a-stronghold-on-society-6-7-six-seven-67-sixseven-school-pennsylvania-school-york-county-school-celebrates-67-day,
2025-12-24T19:35:39Z,facebook.com,My kids might agree with this word of the year.,https://www.facebook.com/story.php?story_fbid=1600426068105358&id=100044139414360,
2025-12-24T20:53:00Z,Axios,U.S. murders on pace for largest one-year drop on record,https://www.axios.com/2025/12/24/us-trump-murder-data-killing-crime-national-guard,Julianna Bragg
2025-12-22T12:58:53Z,Jeff Asher | Substack,2025 Year in Review: A Remarkable Drop In Crime,https://jasher.substack.com/p/2025-year-in-review-a-remarkable,Jeff Asher
2025-12-24T17:02:38Z,WBMA,"Crime data shows Birmingham murders down, mirroring national trend",https://www.ice.gov/news/releases/ice-operation-highway-sentinel-arrests-over-100-illegal-alien-truck-drivers-gavin,
2025-12-24T03:13:59Z,KOMO,100+ illegal alien truck drivers arrested in California; Operation Highway Sentinel,https://komonews.com/news/nation-world/100-illegal-alien-truck-drivers-arrested-in-california-operation-highway-sentinel-deadly-crashes-travel-cdl,Geoff Harris
2025-12-24T09:13:00Z,The Hindu,U.S. border patrol agents arrest 30 Indian nationals living illegally in America,https://www.thehindu.com/news/international/us-border-patrol-agents-arrest-30-indian-nationals-living-illegally-in-america/article70432975.ece,
2025-12-24T17:30:12Z,Santa Clarita Valley Signal,ICE arrests 101 illegal alien truckers in California,https://signalscv.com/2025/12/ice-arrests-101-illegal-alien-truckers-in-california/,Naveen Athrappully
2025-12-23T10:00:00Z,The Telluride Times,"Telski, patrol conclude talks Monday without progress",https://www.telluridenews.com/news/article_5bfe48df-48d5-45dc-814a-6b9810b2911e.html,Owen Perkins
2025-12-24T13:25:34Z,Denver7,Telluride Ski Resort to close ahead of Christmas weekend ski patrol strike,https://www.denver7.com/news/mountains/telluride-ski-resort-to-close-ahead-of-christmas-weekend-ski-patrol-strike,Christine (Tiney) Ricciardi
2025-12-24T21:31:38Z,The Colorado Sun,Telluride ski resort owner Chuck Horning will close the ski area Dec. 27 when patrollers are planning to go on strike,https://coloradosun.com/2025/12/24/chuck-horning-closing-tellluride-ski-area/,Jason Blevins
2025-12-23T21:24:21Z,WJAR,Brown University police chief placed on leave following deadly campus shooting,https://turnto10.com/news/local/brown-university-police-chief-put-on-leave-following-deadly-campus-shooting-former-providence-interim-after-action-assessment-changes-safety-december-23-2025,
2025-12-23T02:46:07Z,ABC News,"Brown University police chief put on leave, Dept. of Education launches review of safety",https://abcnews.go.com/US/brown-university-police-chief-put-leave-dept-education/story?id=128637735,Jason Volack & Leah Sarnoff
2025-12-20T18:32:00Z,New York Post,Brown police chief running 's-tshow' department while touting lefty views for years before deadly shooting,https://nypost.com/2025/12/20/us-news/brown-police-chief-rodney-chatman-running-a-shtshow-department-while-posting-his-progressive-politics/,Shane Galvin
2025-12-23T22:13:00Z,The Times of Israel,What are Mamdani's policy proposals that could directly impact Jewish New Yorkers?,https://www.timesofisrael.com/what-are-mamdanis-policy-proposals-that-could-directly-impact-jewish-new-yorkers/,
2025-12-21T15:02:04Z,The New York Times,Mamdani Inauguration to Usher in 'New Era' With Broadway Block Party,https://www.nytimes.com/2025/12/21/nyregion/nyc-zohran-mamdani-inauguration-block-party.html,Dana Rubinstein
2025-12-22T15:48:00Z,The Hill,Sanders to swear in Mamdani as New York City's mayor,https://thehill.com/homenews/senate/5659696-sanders-swear-in-mamdani-new-york/,Alexander Bolton
2025-12-24T10:03:37Z,Stateline,"GOP redistricting could backfire as urban, immigrant areas turn back to Democrats",https://stateline.org/2025/12/24/gop-redistricting-could-backfire-as-urban-immigrant-areas-turn-back-to-democrats/,Tim Henderson
2025-12-24T17:00:00Z,NPR,"Year in review: Trump, gerrymandering & redistricting",https://www.npr.org/2025/12/24/nx-s1-5638906/year-in-review-trump-gerrymandering-redistricting,Tamara Keith
2025-12-24T11:10:46Z,Politico,The 2028ers who won the redistricting wars,https://www.politico.com/newsletters/playbook/2025/12/24/the-2028ers-who-won-the-redistricting-wars-00705720,Adam Wren
2025-12-25T04:41:00Z,Hawaii News Now,"Hawaii's new tourist tax survives legal challenge, set to take effect soon",https://www.hawaiinewsnow.com/2025/12/25/hawaiis-new-tourist-tax-survives-legal-challenge-set-take-effect-soon/,
2025-12-24T04:59:52Z,KHON2,Court decision allows Hawaii's Green Fee to take full effect,https://www.khon2.com/local-news/court-decision-allows-hawaiis-green-fee-to-take-full-effect/,
2025-12-24T21:18:30Z,TravelMole,Court rules Hawaii can charge cruise lines climate tax,https://www.travelmole.com/news/court-rules-hawaii-can-charge-cruise-lines-climate-tax/,
2025-12-24T22:36:00Z,AP News,"Tina Peters asks Colorado appeals court to recognize Trump's pardon, release her from prison",https://apnews.com/article/trump-pardon-tina-peters-colorado-appeal-28b86c413ae9d112931aaf3fb5a1abd3,Colleen Slevin
2025-12-22T12:01:02Z,The Denver Post,A greater threat to Colorado's elections than Tina Peters? (Opinion),https://www.denverpost.com/2025/12/22/colorado-elections-canvass-board-refusing-certify/,Krista Kafer
2025-12-21T11:00:00Z,Los Angeles Times,Commentary: She went to jail for Trump's Big Lie. He's trying to get her sprung,https://www.latimes.com/politics/story/2025-12-21/trump-tina-peters-phony-pardon-colorado-election-fraud-conviction,Mark Z. Barabak
2025-12-23T11:00:00Z,Los Angeles Times,The best entertainment photos of 2025,https://www.latimes.com/entertainment-arts/story/2025-12-23/best-entertainment-photos-2025,Maane Khatchatourian
2025-12-16T08:00:00Z,The New York Times,The Year in Pictures 2025: Reflecting on Turbulent Times,https://www.nytimes.com/interactive/2025/world/year-in-pictures.html,
2025-12-23T09:00:00Z,The Portland Press Herald,Portland Press Herald 2025 Photos of the Year,https://www.pressherald.com/2025/12/23/portland-press-herald-photos-of-the-year-2/,
2025-12-25T01:24:26Z,NBC10 Philadelphia,"Wintry mix of snow, ice and rain to hit Philly region Friday into Saturday",https://www.nbcphiladelphia.com/weather/stories-weather/winter-storm-snow-rain-sleet-ice-philadelphia-pennsylvania-new-jersey-delaware/4322824/,
2025-12-25T11:22:00Z,WGAL,"HOUR-BY-HOUR: Winter storm projections, accumulation maps",https://www.wgal.com/article/hour-by-hour-snow-winter-storm-weather-totals-pennsylvania/69862853,Christine Ferreira & Rachael Lardani
2025-12-24T20:24:04Z,FOX 29 Philadelphia,"Winter storm watch issued for much of Eastern Pennsylvania, South Jersey this weekend",https://www.fox29.com/news/winter-storm-watch-christmas-philadelphia-pennsylvania-snow,
2025-12-25T08:20:19Z,East Bay Times,Flood advisory for Northern California until 3 a.m. Thursday caused by prolonged downpours,https://www.eastbaytimes.com/2025/12/25/flood-advisory-for-northern-california-until-3-a-m-thursday-caused-by-prolonged-downpours/,
2025-12-25T10:06:16Z,The Mercury News,Flash flood warning in place for San Mateo County until early Thursday morning - urgent action advised,https://www.mercurynews.com/2025/12/25/flash-flood-warning-in-place-for-san-mateo-county-until-early-thursday-morning-urgent-action-advised/,
