Date,Website,URL,Title,Author
2025-12-24T13:00:51Z,Engadget,https://www.engadget.com/computing/accessories/samsungs-latest-odyssey-gaming-monitor-has-a-32-inch-6k-screen-with-glasses-free-3d-130051748.html,Samsung's latest Odyssey gaming monitor has a 32-inch 6K screen with glasses-free 3D,Steve Dent
2025-12-23T15:02:28Z,samsung.com,https://news.samsung.com/us/samsung-unveils-new-odyssey-gaming-monitor-lineup-world-first-6k-3d-ultra-high-resolution-displays/,"Samsung Unveils New Odyssey Gaming Monitor Lineup, Featuring World-First 6K 3D and Ultra-High-Resolution Displays",
2025-12-23T19:13:50Z,The Verge,https://www.theverge.com/news/849850/samsung-odyssey-gaming-monitors-6k-3d-ces-2026,"Samsung's 2026 gaming monitors promise 6K, 3D, and up to 1,040Hz",Emma Roth
2025-12-24T12:30:00Z,Tom's Hardware,https://www.tomshardware.com/monitors/gaming-monitors/samsungs-ces-monitor-lineup-includes-6k-3d-display-with-eye-tracking-plus-a-dual-mode-qhd-panel-with-a-blistering-1080p-1040hz-option,Samsung's CES monitor lineup includes 6K 3D display with eye-tracking - plus a dual-mode QHD panel with a blistering 1080p 1040Hz option,Jowi Morales
2025-12-23T21:00:00Z,The Verge,https://www.theverge.com/gadgets/836995/google-pixel-10-pro-xl-amazon-deal-sale-2025,"The Pixel 10, our favorite Android phone, is nearly 50 percent off right now",Brandon Russell
2025-12-22T23:57:00Z,9to5Google,https://9to5google.com/2025/12/22/google-store-holiday-2025/,"Final Google Store 2025 Pixel deals, boosted trade-ins end this week",Abner Li
2025-12-18T18:39:07Z,Android Central,https://www.androidcentral.com/apps-software/youtube/youtube-premium-hands-out-huge-discounts-so-you-can-get-a-pixel-10,YouTube Premium hands out huge discounts so you can get a Pixel 10,Nickolas Diaz
2025-12-23T16:29:00Z,CNET,https://www.cnet.com/deals/amazon-deals-of-the-day-23-december/,Amazon Deals of the Day: A New Year Means a New Google Pixel Phone at a New Low Price,Aashna Gheewalla
2025-12-23T16:04:57Z,TechCrunch,https://techcrunch.com/2025/12/23/amazons-ai-assistant-alexa-now-works-with-angi-expedia-square-and-yelp/,"Amazon's AI assistant Alexa+ now works with Angi, Expedia, Square, and Yelp",Sarah Perez
2025-12-23T14:02:03Z,About Amazon,https://www.aboutamazon.com/news/devices/alexa-plus-voice-booking-integrations,"Expedia, Yelp, Angi, and Square to build new agentic experiences for Alexa+",
2025-12-18T16:16:42Z,GeekWire,https://www.geekwire.com/2025/with-new-alexa-website-amazons-consumer-ai-vision-finally-comes-together-and-its-actually-useful/,"With new Alexa website, Amazon's consumer AI vision finally comes together - and it's actually useful",Todd Bishop
2025-12-16T23:10:44Z,The Verge,https://www.theverge.com/news/845678/alexa-dot-com-alexa-plus-website-live,Alexa Plus' website is live for some users,Jennifer Pattison Tuohy
2025-12-24T14:18:36Z,BleepingComputer,https://www.bleepingcomputer.com/news/security/mongodb-warns-admins-to-patch-severe-rce-flaw-immediately/,MongoDB warns admins to patch severe RCE flaw immediately,Sergiu Gatlan
2025-12-25T10:34:17Z,Security Affairs,https://securityaffairs.com/186107/security/high-severity-mongodb-flaw-cve-2025-14847-could-lead-to-server-takeover.html,High-severity MongoDB flaw CVE-2025-14847 could lead to server takeover,Pierluigi Paganini
2025-12-24T17:36:00Z,cyberkendra.com,https://www.cyberkendra.com/2025/12/mongodbs-no-login-memory-leak-exposes.html,MongoDB's No-Login Memory Leak Exposes Years of Database Deployments,
2025-12-24T07:02:23Z,Cyber Press,https://cyberpress.org/critical-mongodb-vulnerability-2/,Critical MongoDB Vulnerability Exposes Sensitive Data Through zlib Compression,
2025-12-25T11:00:08Z,Financial Times,https://www.ft.com/content/9b1b1bc3-6573-451d-892b-e6abb819a112,AI 'world models' promise to reshape $190bn video games industry,Cristina Criddle
2025-12-18T11:00:14Z,New York Magazine,https://nymag.com/intelligencer/article/gamers-are-extremely-mad-about-ai.html,Gamers Are Extremely Mad About AI,John Herrman
2025-12-21T18:00:00Z,PC Gamer,https://www.pcgamer.com/games/its-more-important-than-ever-to-call-out-developers-for-egregious-ai-usage-next-year-if-we-want-videogames-to-remain-interesting/,It's more important than ever to call out developers for egregious AI usage next year if we want videogames to remain interesting,Mollie Taylor
2025-12-24T07:55:02Z,GamerBraves,https://www.gamerbraves.com/level-5-explains-how-ai-shapes-game-development-from-decapolice-to-tgs/,"Level-5 Explains How AI Shapes Game Development, From Decapolice to TGS",
2025-12-24T11:45:00Z,Android Central,https://www.androidcentral.com/apps-software/google-one-nye-deals-2025,Google One is offering 50% off its 2TB storage and AI Pro plans right now,Sanuj Bhatia
2025-12-24T18:25:07Z,bgr.com,https://www.bgr.com/2060318/google-one-cloud-storage-plans-new-year-discount/,"Google One Cloud Storage Plans Just Got A 50% Discount, But You'll Have To Act Fast",Chris Smith
2025-12-23T21:05:00Z,9to5Google,https://9to5google.com/2025/12/23/google-one-2026-offer/,Google One discounting annual 2 TB and AI Pro plans by 50%,Abner Li
2025-12-24T12:24:35Z,TechRadar,https://www.techradar.com/computing/cloud-computing/taking-too-many-photos-this-year-get-googles-cloud-storage-for-half-price-to-keep-them-safe-or-check-out-some-of-these-other-great-deals,Taking too many photos this year? Get Google's cloud storage for half price to keep them safe,Ellen Jennings-trace
2025-12-24T20:07:00Z,9to5Google,https://9to5google.com/2025/12/24/pixel-8-camera-new-panorama-mode/,Pixel Camera brings Photo Sphere-esque Panorama mode to Pixel 8,Abner Li
2025-12-24T10:00:00Z,WIRED,https://www.wired.com/story/alphafold-changed-science-after-5-years-its-still-evolving/,"AlphaFold Changed Science. After 5 Years, It's Still Evolving",Sandro Iannaccone
2025-12-22T17:49:05Z,Earth.com,https://www.earth.com/news/the-largest-protein-shape-classification-in-history-finds-700000-unknown-structures-and-13-that-belong-only-to-humans/,"Largest protein classification in history finds 700,000 unknown structures",Jordan Joseph
2025-12-19T16:20:00Z,Interesting Engineering,https://interestingengineering.com/science/deepmind-alphafold-protein-engineering,AlphaFold and the architecture that cracked protein structure,Tejasri Gururaj
2025-12-25T00:00:00Z,Hackaday,https://hackaday.com/2025/12/24/abusing-x86-simd-instructions-to-optimize-playstation-3-emulation/,Abusing X86 SIMD Instructions To Optimize PlayStation 3 Emulation,Maya Posch
2025-12-24T15:24:31Z,MacRumors,https://www.macrumors.com/2025/12/24/apple-discontinued-25-products-this-year/,Apple Discontinued These 25 Products This Year,Joe Rossignol
2025-12-25T14:39:03Z,The Economic Times,https://m.economictimes.com/news/new-updates/macbook-air-m3-iphone-se-more-apple-discontinued-these-devices-and-accessories-in-2025-heres-what-it-means-for-users/articleshow/126175193.cms,"MacBook Air M3, iPhone SE & more: Apple discontinued these devices and accessories in 2025; here's what it",
2025-12-22T17:00:20Z,Cult of Mac,https://www.cultofmac.com/news/products-apple-killed-in-2025,All the products Apple killed in 2025 - with more to come in 2026,David Snow
2025-12-25T06:04:33Z,The Hans India,https://www.thehansindia.com/tech/apple-retires-25-products-in-2025-marking-a-clean-break-from-familiar-designs-1033636,"Apple Retires 25 Products in 2025, Marking a Clean Break From Familiar Designs",Kahekashan Kahekashan
2025-12-24T12:05:34Z,Gematsu,https://www.gematsu.com/2025/12/tanuki-pons-summer-delayed-to-2026,TANUKI: Pon's Summer delayed to 2026,Sal Romano
2025-12-24T21:24:29Z,Mashable,https://mashable.com/article/dec-24-dji-mic-mini-deal,Best DJI deal: Save 53% on the DJI Mic Mini,Lauren Allain
2025-12-24T11:46:26Z,What Hi-Fi?,https://www.whathifi.com/tv-home-cinema/what-to-expect-from-lg-in-2026-rgb-mini-led-oled-and-dolby-atmos-flex-connect,"What to expect from LG in 2026: RGB Mini LED, OLED and Dolby Atmos Flex Connect",Lewis Empson
2025-12-16T08:00:00Z,lgnewsroom.com,https://www.lgnewsroom.com/2025/12/lg-micro-rgb-evo-lgs-most-advanced-lcd-tv-powered-by-the-precision-of-oleds-ai-processor/,LG Micro RGB evo: LG's Most Advanced LCD TV Powered by the Precision of OLED's AI Processor,
2025-12-21T09:08:25Z,New Atlas,https://newatlas.com/home-entertainment/micro-rgb-tv-2026/,Micro RGB TVs are coming: Should you get excited about them in 2026?,Abhimanyu Ghoshal
2025-12-16T01:00:00Z,Engadget,https://www.engadget.com/home/home-theater/lg-will-debut-its-first-micro-rgb-television-at-ces-010037923.html,LG will debut its first Micro RGB television at CES,Anna Washenko
2025-12-23T23:02:28Z,Game Informer,https://gameinformer.com/tabletop/2025/12/23/the-best-tabletop-rpgs-of-2025,The Best Tabletop RPGs Of 2025,Paulo Kawanishi
2025-12-23T11:00:00Z,Polygon,https://www.polygon.com/best-jrpgs-2025/,I played all of 2025's big JRPGs. Here are the best,Paulo Kawanishi
2025-12-19T17:00:00Z,GameSpot,https://www.gamespot.com/gallery/the-best-rpgs-of-2025-according-to-metacritic/2900-7301/,The Best RPGs Of 2025 According To Metacritic,Jordan Ramée
2025-12-22T14:00:00Z,Wccftech,https://wccftech.com/wccftechs-best-role-playing-games-of-2025-another-incredible-year/,Wccftech's Best Role-Playing Games of 2025 - Another Incredible Year,Francesco De Meo
2025-12-24T11:11:23Z,My Nintendo News,https://mynintendonews.com/2025/12/24/us-cd-projekt-red-honouring-cyberpunk-2077-ultimate-edition-eshop-price-error/,US: CD Projekt Red honouring Cyberpunk 2077 Ultimate Edition eShop price error,Wesley Yin-Poole
2025-12-24T09:31:47Z,IGN,https://www.ign.com/articles/cyberpunk-2077-and-the-witcher-3s-huge-eshop-discounts-were-an-error-cd-projekt-says-but-it-will-honor-any-sales-made,"Cyberpunk 2077 and The Witcher 3's Huge eShop Discounts Were an 'Error,' CD Projekt Says, but It Will Honor Any Sales Made",Wesley Yin-Poole
2025-12-22T14:30:37Z,Kotaku,https://kotaku.com/the-switch-2s-most-impressive-port-is-75-percent-off-right-now-2000655205,"Switch 2 Holiday Sale Includes Big Deals On Star Wars, NBA, & More",Zack Zwiezen
2025-12-24T06:49:12Z,Twisted Voxel,https://twistedvoxel.com/cd-projekt-red-confirms-cyberpunk-2077-switch-2-discount-error/,CD Projekt Red Confirms Cyberpunk 2077 Switch 2 Discount Error,Salal Awan
2025-12-24T20:30:04Z,PetaPixel,https://petapixel.com/2025/12/24/sony-in-2025-sony-demonstrated-its-engineering-excellence-this-year/,Sony in 2025: Sony Demonstrated its Engineering Excellence This Year,Jeremy Gray
2025-12-23T20:07:39Z,PlayStation LifeStyle,https://www.playstationlifestyle.net/2025/12/23/the-witcher-3-wild-hunt-dlc-report-december-2025/,"Hit PS5, PS4 RPG Getting 'Big' DLC 11 Years After Original Launch - Report",Michael Joseph Ruiz
2025-12-23T16:46:00Z,Wccftech,https://wccftech.com/ready-to-return-to-the-continent-analysts-expect-a-big-the-witcher-3-dlc-expansion-to-drop-next-year/,Ready to Return to The Continent? Analyst Expects a 'Big' The Witcher 3 DLC Expansion To Drop Next Year,Francesco De Meo
2025-12-23T17:38:00Z,Metro.co.uk,https://metro.co.uk/2025/12/23/witcher-3-get-new-dlc-acts-witcher-4-prologue-says-analyst-25738388/,The Witcher 3 to get new DLC that acts as The Witcher 4 prologue says analyst,
2025-12-24T10:48:14Z,Twisted Voxel,https://twistedvoxel.com/analyst-predicts-paid-witcher-3-expansion-launching-in-may-2026/,Analyst Predicts Paid Witcher 3 Expansion Launching in May 2026,Salal Awan
2025-12-24T18:17:00Z,bgr.com,https://www.bgr.com/2056120/oled-vs-qled-tv-differences-explained/,OLED Vs. QLED TVs: What's The Difference?,Michael Bizzaco
2025-12-24T18:00:00Z,Hackaday,https://hackaday.com/2025/12/24/diy-e-reader-folds-open-like-a-book/,DIY E-Reader Folds Open Like A Book,Lewin Day
2025-12-23T22:38:59Z,GameSpot,https://www.gamespot.com/gallery/best-games-to-play-during-the-holidays/2900-7381/,The Best Games To Play Over The Holiday Break 2025,Tori Lee
2025-12-17T20:16:22Z,University of Chicago News,https://news.uchicago.edu/story/games-play-over-winter-break-2025,Games to play over winter break 2025,Tori Lee
2025-12-25T08:00:00Z,Eurogamer,https://www.eurogamer.net/what-weve-been-playing-christmas-day-edition-hope-i-dont-disgrace-myself,"What we've been playing, Christmas Day edition - ""hope I don't disgrace myself""",Tom Orry
2025-12-24T02:00:00Z,Metro.co.uk,https://metro.co.uk/2025/12/24/games-inbox-what-video-games-will-you-play-over-christmas-25747541/,Games Inbox: What video games will you play over Christmas?,
2025-12-24T15:25:37Z,MacRumors,https://www.macrumors.com/2025/12/24/iphone-air-2-could-still-launch-next-year/,iPhone Air 2 Could Still Launch Next Year,Hartley Charlton
2025-12-25T07:54:42Z,livemint.com,https://www.livemint.com/technology/tech-news/apple-iphone-air-2-leak-hints-at-earlier-launch-and-major-design-tweaks-11766648813836.html,Apple iPhone Air 2 leak hints at earlier launch and major design tweaks,Govind Choudhary
2025-12-24T18:37:31Z,iClarified,https://www.iclarified.com/99480/secondgen-iphone-air-set-for-fall-launch-as-iphone-17e-enters-mass-production-rumor,Second-Gen iPhone Air Set for Fall Launch as iPhone 17e Enters Mass Production [Rumor],
2025-12-24T16:42:00Z,AppleInsider,https://appleinsider.com/articles/25/12/24/leaker-battle-iphone-air-2-will-ship-in-2026-and-not-wait-until-2027,"Leaker battle: iPhone Air 2 will ship in 2026, and not wait until 2027",Malcolm Owen
2025-12-24T17:44:46Z,BleepingComputer,https://www.bleepingcomputer.com/news/security/fake-mas-windows-activation-domain-used-to-spread-powershell-malware/,Fake MAS Windows activation domain used to spread PowerShell malware,Bill Toulas
2025-12-24T16:25:00Z,Jalopnik,https://www.jalopnik.com/2059283/lightweight-wheels-performance-test-results/,This Test Shows The Limits Of Lightweight Wheels (But There Are Still Lessons Worth Learning),Paul Stadden-writer
2025-12-24T16:17:00Z,bgr.com,https://www.bgr.com/2056018/best-apple-watch-face-apps-worth-trying/,The 5 Best Apple Watch Face Apps You Need To Try,
2025-12-24T14:27:36Z,The Ringer,https://www.theringer.com/2025/12/24/tv/five-questions-after-the-finale-of-pluribus-la-chica-o-el-mundo-apple-tv,Five Questions After the Finale of 'Pluribus',
