Date,Website,Title,URL,Author
2025-12-30T19:17:00Z,The Guardian,Alaa Abd el-Fattah 'will not be stripped of British citizenship' over past tweets,https://www.theguardian.com/politics/2025/dec/30/alaa-abd-el-fattah-british-citizenship-home-office,Rowena Mason
2025-12-30T09:00:00Z,The Guardian,Trump shows customary disdain for protocol as poker-faced Netanyahu looks on,https://www.theguardian.com/world/2025/dec/30/donald-trump-benjamin-netanyahu-white-house-conference-analysis,Robert T. Yamate
2025-12-30T11:56:46Z,The Economist,Netanyahu wins bigly from his meeting with Trump,https://www.economist.com/middle-east-and-africa/2025/12/30/netanyahu-wins-bigly-from-his-meeting-with-trump,
2025-12-29T23:55:25Z,PBS,Trump warns Hamas must disarm for Gaza peace deal to reach next phase,https://www.pbs.org/newshour/show/trump-warns-hamas-must-disarm-for-gaza-peace-deal-to-reach-next-phase,Janine Alhadidi
2025-12-31T22:44:50Z,The New York Times,"Sabotage Suspected in Cutting of Undersea Cable, Finnish Police Say",https://www.nytimes.com/2025/12/31/world/europe/underwater-cable-damaged-sabotage-finland-estonia.html,Johanna Lemola & Neil Vigdor
2025-12-31T16:48:43Z,BBC,Finnish police seize ship suspected of sabotaging undersea telecoms cable,https://www.bbc.com/news/articles/c62040np372o,Gabriela Pomeroy
2025-12-31T02:08:42Z,KSL.com,UAE to pull remaining forces from Yemen in crisis with Saudi Arabia,https://www.ksl.com/article/51424827/uae-to-pull-remaining-forces-from-yemen-in-crisis-with-saudi-arabia,"Maha El Dahan, El Dahan & Nayera Abdallah"
2025-12-30T06:39:36Z,The New York Times,Emirates to Pull Troops Out of Yemen After Saudi-Led Airstrike,https://www.nytimes.com/2025/12/30/world/middleeast/yemen-saudi-strike-uae.html,Saeed Al Batati & Ismaeel Naar
2026-01-01T01:36:00Z,USA Today,See NYE celebrations around the world as 2025 comes to an end,https://www.usatoday.com/story/news/nation/2025/12/31/watch-live-us-nye-2025-celebrations/87978493007/,Emily Shapiro
2025-12-31T23:56:00Z,ESPN,Ex-champ Joshua out of hospital after car crash,https://www.espn.com/boxing/story/_/id/47466722/ex-champ-anthony-joshua-released-hospital-car-crash,Josh Peter
2025-12-29T18:54:00Z,ESPN,"Ex-boxing champ Joshua hurt in crash, two killed",https://www.espn.com/boxing/story/_/id/47442977/anthony-joshua-injured-car-crash-nigeria-two-killed,
2026-01-01T03:48:00Z,USA Today,Boxer Anthony Joshua released from hospital after fatal crash,https://www.usatoday.com/story/sports/boxing/2025/12/31/anthony-joshua-released-hospital-fatal-crash-nigeria/87979175007/,Josh Peter
2025-12-30T12:56:26Z,Yahoo Sports,Tragedy follows triumph for Anthony Joshua with boxing future uncertain,https://sports.yahoo.com/articles/tragedy-follows-triumph-anthony-joshua-125626366.html,
2026-01-01T00:22:13Z,The New York Times,Suicide Bomber in Syria Kills Security Officer in New Year's Eve Attack,https://www.nytimes.com/2025/12/31/world/middleeast/aleppo-syria-suicide-bomber-new-years-eve.html,Hussam Hammoud & Ephrat Livni
2025-12-31T18:16:57Z,Financial Times,How Saudi Arabia and the UAE's long alliance ruptured,https://www.ft.com/content/2097d5e6-5e59-4af8-bcda-3707d8e9f9ef,Andrew England
2025-12-30T20:16:20Z,Al Jazeera,Updates: UAE says troops to leave Yemen as Saudi Arabia backs withdrawal,https://www.aljazeera.com/news/liveblog/2025/12/30/live-yemens-presidential-council-cancels-uae-defence-deal,"Umut Uras, Edna Mohamed & Maziar Motamedi"
2025-12-30T04:09:00Z,The Wall Street Journal,Saudi Arabia Bombs Yemeni Port City Over Weapons Shipment From U.A.E.,https://www.wsj.com/world/middle-east/saudi-arabia-bombs-yemeni-port-city-over-weapons-shipment-from-the-u-a-e-2f457b22,Michael Amon
2025-12-31T13:11:35Z,Australian Broadcasting Corporation,Sydney Harbour celebrations sombre as Australia rings in New Year,https://www.abc.net.au/news/2026-01-01/sydney-sombre-new-year-celebrations-/106190882,
2025-12-31T23:43:39Z,CBS News,"Judge voids decision to end legal status of 60,000 immigrants from Honduras, Nepal and Nicaragua",https://www.cbsnews.com/news/judge-temporary-protected-status-honduras-nepal-nicaragua/,Camilo Montoya-Galvez
2025-12-31T19:03:56Z,Reuters,"US judge blocks Trump move to end protected status for thousands from Honduras, Nepal and Nicaragua",https://www.reuters.com/legal/government/us-judge-blocks-trump-move-end-protected-status-thousands-honduras-nepal-2025-12-31/,Ted Hesson
2025-12-30T19:51:30Z,Fox News,Judge halts Homeland Security plan to end Temporary Protected Status for South Sudan,https://www.foxnews.com/us/judge-halts-homeland-security-plan-end-temporary-protected-status-south-sudan,Alexandra Koch
2025-12-31T14:19:44Z,NBC News,Judge temporarily bars Trump's move to end protected status for South Sudanese immigrants,https://www.nbcnews.com/news/us-news/judge-temporarily-bars-trumps-move-end-protected-status-south-sudanese-rcna251663,
2025-12-31T16:50:04Z,NBC News,Finland seizes ship sailing from Russia after suspected cable sabotage,https://www.nbcnews.com/world/europe/finland-seizes-ship-sailing-russia-suspected-cable-sabotage-rcna251698,Essi Lehto & Anne Kauranen
2025-12-31T16:48:43Z,BBC,Finnish police seize ship suspected of sabotaging undersea cable,https://www.bbc.com/news/articles/c62040np372o,Gabriela Pomeroy
2025-12-31T12:45:21Z,ABC News,China announces it 'successfully completed' Taiwan military maneuvers,https://abcnews.go.com/International/wireStory/china-announces-successfully-completed-taiwan-military-maneuvers-128801777,Ted Anthony
2025-12-31T10:53:00Z,The Wall Street Journal,Five Takeaways From China's Military Drills Around Taiwan,https://www.wsj.com/world/asia/five-takeaways-from-chinas-military-drills-around-taiwan-47c64aee,Joyu Wang
2026-01-01T02:50:21Z,Al Jazeera,'We're not scared': Life in Taiwan goes on amid major Chinese war games,https://www.aljazeera.com/features/2026/1/1/were-not-scared-life-in-taiwan-goes-on-amid-major-chinese-war-games,Jordyn Haime
2026-01-01T03:00:00Z,Reuters,Taiwan vows to defend sovereignty after China's military drill,https://www.reuters.com/world/china/taiwan-vows-defend-sovereignty-after-chinas-military-drill-2026-01-01/,Yimou Lee
2025-12-31T06:28:46Z,Al Jazeera,An A-Z list of 2025's biggest stories,https://www.aljazeera.com/news/longform/2025/12/31/an-a-z-list-of-2025s-biggest-stories,Hanna Duggal & Konstantinos Antonopoulos
2025-12-29T21:25:00Z,The Wall Street Journal,"Opinion | The Good, the Bad and the Ugly of 2025",https://www.wsj.com/opinion/the-good-the-bad-and-the-ugly-of-2025-ee817f92,Karl Rove
2025-12-31T10:00:55Z,The New York Times,Opinion | The 2025 Politics Yearbook: Most Likely to Be Extreme and Chaotic,https://www.nytimes.com/2025/12/31/opinion/congress-most-likely.html,Michelle Cottle
2025-12-31T11:35:45Z,The Washington Post,Opinion | Was 2025 the 'end of America'? Of course not.,https://www.washingtonpost.com/podcasts/impromptu/was-2025-the-end-of-america-of-course-not/,Megan McArdle
2025-12-31T01:31:00Z,AP News,China flexes blockade capabilities near Taiwan on second day of military drills,https://apnews.com/article/china-military-drills-taiwan-us-japan-cd6600c23c206385822c733dc2016217,
2025-12-30T23:51:53Z,The Washington Post,Tensions between Saudi Arabia and UAE spike with bombing of port,https://www.washingtonpost.com/world/2025/12/30/saudi-arabia-yemen-strikes-uae-mukalla/,Claire Parker & Abbie Cheeseman
2025-12-31T01:26:21Z,The New York Times,Saudis Say Airstrike in Yemen Targeted Arms From U.A.E.,https://www.nytimes.com/2025/12/30/world/middleeast/yemen-saudi-strike-uae.html,Saeed Al Batati & Ismaeel Naar
2025-12-31T01:08:10Z,Al Jazeera,"Train crash near Peru's Machu Picchu kills driver, injures dozens",https://www.aljazeera.com/news/2025/12/31/train-crash-near-perus-machu-picchu-kills-driver-injures-dozens,
2025-12-31T00:19:00Z,CNN,"Trains crash while carrying tourists to Peru's Machu Picchu, killing 1 person and injuring dozens",https://www.cnn.com/2025/12/30/americas/peru-machu-picchu-train-crash-latam-intl,
2025-12-31T02:08:00Z,The Guardian,Machu Picchu head-on train crash kills one person and injures dozens,https://www.theguardian.com/world/2025/dec/31/peru-machu-pichu-head-on-train-crash,
2025-12-31T00:27:06Z,CBS News,"Head-on train collision near Peru's Machu Picchu kills at least 1, injures 40",https://www.cbsnews.com/news/train-collision-near-machu-picchu-peru/,
2025-12-30T23:20:19Z,CNN,Thieves drill into German bank vault and make off with millions,https://www.cnn.com/2025/12/30/europe/thieves-drill-into-german-bank-vault-and-make-off-with-millions-latam-intl,Amy Walker
2025-12-30T16:54:32Z,BBC,Thieves use drill to steal €30m in German bank heist,https://www.bbc.com/news/articles/c4grzz60kp3o,Amy Walker
2025-12-30T15:01:03Z,dw.com,Germany: €30 million stolen in elaborate bank vault heist,https://www.dw.com/en/germany-gelsenkirchen-bank-heist-30-millio-75344406,
2025-12-30T16:12:12Z,CBS News,"Thieves drill into Germany bank vault from parking garage, steal $35 million worth of cash and valuables",https://www.cbsnews.com/news/germany-bank-heist-vault-robbery-compared-to-oceans-eleven/,
2025-12-31T01:36:37Z,The Washington Post,Trump sends 'wartime prime minister' Netanyahu back to Israel with a boost,https://www.washingtonpost.com/world/2025/12/30/trump-netanyahu-iran-gaza/,Loveday Morris & Lior Soroka
2025-12-30T00:02:11Z,The New York Times,"Trump and Netanyahu Praise Each Other After Meeting, Despite Differences Over Gaza",https://www.nytimes.com/2025/12/29/us/politics/trump-netanyahu-israel-meeting.html,Tyler Pager & David Halbfinger
2025-12-29T20:17:57Z,CNBC,Trump threatens to 'knock the hell' out of Iran if they build weapons,https://www.cnbc.com/2025/12/29/trump-iran.html,Justin Papp
2025-12-30T16:27:43Z,The New York Times,"Spanish Woman Scorned, Then Loved, for Botched Fresco Restoration Dies at 94",https://www.nytimes.com/2025/12/30/world/europe/spain-jesus-fresco-restoration-painter-gimenez-dead.html,Amelia Nierenberg
2025-12-30T20:20:00Z,The Guardian,"Cecilia Giménez, famed for 'Monkey Christ' mural mishap, dies at 94 | Spain",https://www.theguardian.com/world/2025/dec/30/cecilia-gimenez-monkey-christ-mural-dies-spain,Stephen Burgen
2025-12-30T16:29:51Z,NPR,"Cecilia Giménez, the artist who 'restored' the face of Jesus, has died at 94",https://www.npr.org/2025/12/30/nx-s1-5661514/cecilia-gimenez-dead-artist-jesus-fresco,Andrew Limbong
2025-12-29T17:09:41Z,Euronews.com,"Cecilia Giménez, the painter who 'botched' the Ecce Homo dies aged 94",https://www.euronews.com/culture/2025/12/29/cecilia-gimenez-the-amateur-painter-who-botched-the-ecce-homo-fresco-restoration-dies-aged,
2025-12-30T12:50:42Z,Euronews.com,Russia shows nuclear-capable Oreshnik missile system deployed in Belarus,https://www.euronews.com/2025/12/30/russia-nuclear-oreshnik-missile-belarus,Luke Harding
2025-12-30T20:27:00Z,The Guardian,Russia claims to have moved nuclear-capable missile system into Belarus,https://www.theguardian.com/world/2025/dec/30/russia-claims-moved-nuclear-capable-missile-system-belarus,Luke Harding
2025-12-31T03:25:00Z,politico.eu,Russia puts nuclear-capable Oreshnik missile on 'combat duty' in Belarus,https://www.politico.eu/article/russia-nuclear-capable-oreshnik-hypersonic-missile-combat-duty-belarus/,Tom Nicholson
2025-12-30T07:49:00Z,Українська правда,Russians demonstrate Oreshnik missile system in Belarus after alleged attack on Putin residence,https://www.pravda.com.ua/eng/news/2025/12/30/8013946/,Stanislav Pohorilov
2025-12-30T22:36:43Z,BBC,Israel to bar 37 aid groups from Gaza,https://www.bbc.com/news/articles/c1evp7weyv2o,Ephrat Livni
2025-12-30T22:07:21Z,The New York Times,Gaza Aid Groups Face Suspensions Under New Israeli Rules,https://www.nytimes.com/2025/12/30/world/middleeast/gaza-aid-group-suspensions-israel.html,Ephrat Livni
2025-12-22T16:23:53Z,Doctors Without Borders,MSF's vital humanitarian assistance at risk amid Israel's new INGO registration rules for Gaza,https://www.doctorswithoutborders.org/latest/msfs-vital-humanitarian-assistance-risk-amid-israels-new-ingo-registration-rules-gaza,
2025-12-31T01:27:58Z,BBC,Guinea elections: Gen Mamady Doumbouya wins controversial election,https://www.bbc.com/news/articles/cx2520nyp8yo,Omega Rakotomalala & Favour Nunoo
2025-12-31T01:26:13Z,Al Jazeera,Guinea coup leader Mamady Doumbouya wins presidential election,https://www.aljazeera.com/news/2025/12/30/guinea-coup-leader-mamdi-doumbouya-wins-presidential-election,
2025-12-31T00:24:33Z,France 24,Guinea coup leader Doumbouya elected president in provisional results,https://www.france24.com/efrica/20251231-guinea-coup-leader-doumbouya-elected-president,
2025-12-28T05:01:14Z,The New York Times,Guinea Goes to Polls as Ruling Junta Seeks Legitimacy,https://www.nytimes.com/2025/12/28/world/africa/guinea-elections-junta-mining.html,Saikou Jammeh
2025-12-30T13:38:00Z,CBS News,Search for missing MH370 plane resumes in Indian Ocean 12 years after it vanished with 239 people on board,https://www.cbsnews.com/news/mh370-missing-plane-search-resumes-indian-ocean-infinity-12-years-later/,Ramy Inocencio
2025-12-30T14:29:20Z,NBC News,"MH370: Search for missing Malaysia Airlines flight resumes, reviving hope of answers delayed for a decade",https://www.nbcnews.com/world/asia/mh370-search-missing-malaysia-airlines-flight-resumes-rcna251313,
2025-12-30T09:51:36Z,NPR,"More than a decade after its disappearance, Malaysia to resume search for MH370",https://www.npr.org/2025/12/30/nx-s1-5660675/more-than-a-decade-after-its-disappearance-malaysia-to-resume-search-for-mh370,Jennifer Pak
2025-12-30T02:31:00Z,The Guardian,Search for Malaysia Airlines flight MH370 expected to resume on Tuesday,https://www.theguardian.com/world/2025/dec/29/search-for-malaysia-airlines-flight-mh370-expected-to-resume,Rebecca Ratcliffe
2025-12-30T03:07:00Z,Reuters,China launches live-firing drills around Taiwan simulating blockade,https://www.reuters.com/world/china/china-launches-live-firing-drills-around-taiwan-its-biggest-war-games-date-2025-12-30/,Joe Cash & Yimou Lee
2025-12-30T04:07:00Z,The Guardian,"Trump not worried by China's simulated attack on Taiwan, he says, as live-fire drills enter second day",https://www.theguardian.com/world/2025/dec/30/trump-not-worried-china-military-live-fire-drills-taiwan,Helen Davidson
2025-12-30T03:22:12Z,BBC,'No worries': Trump downplays Chinese military drills around Taiwan,https://www.bbc.com/news/articles/cdxwxkeg9w6o,Kelly Ng
2025-12-29T22:47:13Z,Reuters,China stages record drills designed to encircle Taiwan,https://www.reuters.com/world/china/chinas-military-conduct-live-fire-exercises-around-taiwan-tuesday-2025-12-28/,
2025-12-30T01:51:07Z,BBC,Bangladesh's first female prime minister Khaleda Zia dies aged 80,https://www.bbc.com/news/articles/cm2v256vdkyo,Kelly Ng
2025-12-30T02:23:40Z,The New York Times,"Khaleda Zia, Bangladesh's First Female Prime Minister, Dies",https://www.nytimes.com/2025/12/29/world/asia/khaleda-zia-bangladesh-dead.html,Mujib Mashal & Saif Hasnat
2025-12-30T02:12:00Z,CNN,"Khaleda Zia, former Bangladeshi prime minister and archrival of Hasina, dies at 80",https://www.cnn.com/2025/12/29/asia/khaleda-zia-bangladesh-death-intl-hnk,
2025-12-30T03:42:00Z,The Guardian,"Khaleda Zia, first female Bangladesh prime minister, dies aged 80",https://www.theguardian.com/world/2025/dec/30/khaleda-zia-first-female-bangladesh-prime-minister-dies-aged-80,
2025-12-29T22:28:40Z,The Guardian,Trump says 'there'll be hell to pay' if Hamas does not disarm as he meets Netanyahu at Mar-a-Lago - as it happened,https://www.theguardian.com/us-news/live/2025/dec/29/trump-netanyahu-israel-gaza-live,"Kirsty Mcewen, Lucy Campbell & Frances Mao"
2025-12-30T04:42:00Z,The New York Times,"Trump Live Updates: Netanyahu Meeting, Ukraine Talks, Venezuela and More",https://www.nytimes.com/live/2025/12/29/us/trump-news,"Tyler Pager, David Halbfinger & Michael Gold"
2025-12-29T22:32:10Z,x.com,"Israel has never had a friend in the White House like President Trump. His leadership, clarity, and unwavering support for Israel are exceptional. True friendship is proven in moments of challenge, and President Trump has stood with Israel every step of the wa",https://x.com/netanyahu/status/2005768836574830621,
2025-12-28T22:57:00Z,CBS News,Bondi Beach shooting hero says he just wanted to stop the assailant from killing more innocent people,https://www.cbsnews.com/news/bondi-beach-hero-ahmed-al-ahmed/,Anna Coren & Emily Mae Czachor
2025-12-29T05:47:02Z,BBC,Bondi hero says he wanted to stop gunman killing innocent people,https://www.bbc.com/news/articles/cx2g263v3kzo,Lana Lam
2025-12-29T05:03:00Z,The Guardian,'My target was just to take the gun': wounded hero Ahmed al-Ahmed speaks of saving lives at Bondi beach,https://www.theguardian.com/australia-news/2025/dec/29/wounded-hero-ahmed-al-ahmed-speaks-of-saving-lives-at-bondi-beach-ntwnfb,Nino Bucci
2025-12-29T08:07:54Z,i24NEWS,Sydney Attack Hero Recounts: 'My Soul Commanded Me To Stop Him',https://www.i24news.tv/en/news/international/asia-pacific/artc-sydney-attack-hero-recounts-my-soul-commanded-me-to-stop-him,
2025-12-30T03:17:00Z,The Washington Post,"Israeli recognition of Somaliland prompts global outcry, emergency U.N. meeting",https://www.washingtonpost.com/world/2025/12/29/israel-somaliland-recognition-palestine-trump/,Sammy Westfall & Mikhail Klimentov
2025-12-30T03:33:42Z,Al Jazeera,UN Security Council members condemn Israel's recognition of Somaliland,https://www.aljazeera.com/news/2025/12/30/un-security-council-members-condemn-israels-recognition-of-somaliland,
2025-12-29T15:32:02Z,Reuters,"China opposes recognition of Somaliland, affirms support for Somalia",https://www.reuters.com/world/china/china-opposes-recognition-somaliland-affirms-support-somalia-2025-12-29/,
2025-12-26T22:26:00Z,New York Post,Exclusive | Trump tells The Post he's not ready to embrace Somaliland independence - unlike pal Netanyahu,https://nypost.com/2025/12/26/us-news/trump-not-ready-to-embrace-somaliland-independence-unlike-netanyahu/,Steven Nelson
2025-12-29T20:17:31Z,The New York Times,"U.S. Pledges $2 Billion for U.N. Aid but Trump Administration Tells Agencies to 'Adapt, Shrink, or Die'",https://www.nytimes.com/2025/12/29/world/europe/us-un-aid-funding-foreign-assistance.html,
2025-12-29T15:53:01Z,CNN,US pledges $2 billion for UN humanitarian aid as Trump slashes funding and warns agencies to 'adapt or die',https://www.cnn.com/2025/12/29/politics/un-humanitarian-aid-us-funding,
2025-12-29T20:08:02Z,UN News,"UN, US sign $2 billion humanitarian funding agreement for 17 crisis-hit countries",https://news.un.org/en/story/2025/12/1166678,
2025-12-29T20:19:00Z,The Guardian,US pledges $2bn in new UN model for delivery of humanitarian assistance,https://www.theguardian.com/us-news/2025/dec/29/us-pledge-un-model-humanitarian-assistance,
2025-12-29T22:32:12Z,Arsenal.com,Leah Williamson awarded a CBE in Honours List,https://www.arsenal.com/news/leah-williamson-awarded-cbe-honours-list,Jenny Gross
2025-12-29T22:30:06Z,The New York Times,Idris Elba and Cynthia Erivo Make King Charles's New Year Honors List,https://www.nytimes.com/2025/12/29/world/europe/idris-elba-cynthia-erivo-king-charles-honors.html,Jenny Gross
2025-12-29T22:30:24Z,BBC,"New Year Honours 2026: Jayne Torvill, Christopher Dean & Sarina Wiegman recognised",https://www.bbc.com/sport/articles/cy0p75qn0qqo,Simon Armstrong
2025-12-29T22:30:00Z,ESPN,New Year Honours 2026: Lionesses coach Sarina Wiegman honoured with damehood,https://www.espn.com/espn/story/_/id/47442466/new-year-honours-2026-lionesses-coach-sarina-wiegman-honoured-damehood,
2025-12-29T10:38:29Z,BBC,Thailand accuses Cambodia of breaking newly signed ceasefire,https://www.bbc.com/news/articles/c9w7wgrk01do,Yvette Tan
2025-12-29T07:16:00Z,Bloomberg.com,China Swipes at Trump in Move to Be Thai-Cambodia Peacemaker,https://www.bloomberg.com/news/articles/2025-12-29/china-swipes-at-trump-in-move-to-play-thai-cambodia-peacemaker,Josh Xiao & Suttinee Yuvejwattana
2025-12-29T11:26:49Z,ABC News,"Top diplomats of China, Cambodia and Thailand meet as Beijing seeks a stronger role in dispute",https://abcnews.go.com/International/wireStory/top-diplomats-china-cambodia-thailand-meet-beijing-seeks-128744536,Kanis Leung
2025-12-29T02:30:00Z,The Guardian,Myanmar is going to the polls. But it's not the people who hold the power - it's China,https://www.theguardian.com/world/2025/dec/28/myanmar-is-going-to-the-polls-but-its-not-the-people-who-hold-the-power-its-china,Caolán Magee
2025-12-29T15:36:14Z,Al Jazeera,Myanmar pro-military party claims huge lead in contentious elections,https://www.aljazeera.com/news/2025/12/29/myanmar-pro-military-party-claims-huge-lead-in-contentious-elections,Caolán Magee
2025-12-28T13:40:34Z,Reuters,"Weak turnout seen in Myanmar's phased election, first since 2021 coup",https://www.reuters.com/world/asia-pacific/myanmar-polls-open-amid-civil-war-junta-backed-party-tipped-win-2025-12-27/,"Josh Smith, William Mallard & Helen Popper"
2025-12-28T07:37:08Z,BBC,Polls close on first day of Myanmar's widely criticised 'sham' election,https://www.bbc.com/news/articles/cy7vly6gm76o,Cachella Smith
2025-12-29T14:19:40Z,Reuters,Aid workers find little life in Sudan's al-Fashir after paramilitary takeover,https://www.reuters.com/world/africa/aid-workers-find-little-life-sudans-al-fashir-after-paramilitary-takeover-2025-12-29/,Nafisa Eltahir
2025-12-23T08:53:22Z,Al Jazeera,I volunteered at camp for the displaced from el-Fasher. Here is what I saw,https://www.aljazeera.com/opinions/2025/12/23/i-volunteered-at-camp-for-the-displaced-from-el-fasher-here-is-what-i-saw,Nabiha Islam
2025-12-28T17:10:23Z,Anadolu Ajansı,"Insecurity forces over 1,200 more civilians to flee Sudan's Kordofan: UN",https://www.aa.com.tr/en/world/insecurity-forces-over-1-200-more-civilians-to-flee-sudan-s-kordofan-un/3783299,
2025-12-29T14:32:05Z,France 24,First UN visit to Sudan's El-Fasher finds traumatised civilians amid reports of mass atrocities,https://www.france24.com/en/africa/20251229-first-un-visit-to-sudan-el-fasher-finds-traumatised-civilians-amid-reports-mass-atrocities-rsf,
2025-12-28T01:56:03Z,DW,EU backs Somalia after Israel recognizes Somaliland,https://www.dw.com/en/eu-backs-somalia-after-israel-recognizes-somaliland/a-75318108,Nik Martin
2025-12-27T19:22:00Z,AP News,More countries reject Israel's recognition of Somaliland,https://apnews.com/article/somalia-somaliland-recognition-israel-0643e819cc043163d7a81c91617232a9,
2025-12-27T10:44:23Z,Al Jazeera,Somalia demands Israel withdraw Somaliland recognition,https://www.aljazeera.com/news/2025/12/27/state-aggression-somalia-demands-israel-withdraw-somaliland-recognition,
2025-12-27T21:03:00Z,AP News,Thailand and Cambodia sign a new ceasefire agreement to end border fighting,https://apnews.com/article/thailand-cambodia-border-fighting-ceasefire-0019310e1c062cd211f9f5398b3bc463,Sopheng Cheang
2025-12-27T13:55:22Z,BBC,Thailand-Cambodia ceasefire begins after weeks of deadly clashes,https://www.bbc.com/news/articles/c0q5je8048xo,Jonathan Head
2025-12-27T08:36:06Z,CNBC,Thailand and Cambodia halt fierce border conflict with second ceasefire,https://www.cnbc.com/2025/12/27/thailand-and-cambodia-halt-fierce-border-conflict-with-second-ceasefire.html,
2025-12-28T02:49:00Z,CNN,Indonesian rescuers search for Spanish soccer coach and 3 children after tour boat sinks,https://www.cnn.com/2025/12/27/asia/spanish-family-boat-sinks-indonesia-intl-hnk,Kimberlee Speakman
2025-12-27T13:58:00Z,realmadrid.com,Official Announcement,https://www.realmadrid.com/en-US/news/club/announcements/comunicado-oficial-27-12-2025,
2025-12-27T17:54:26Z,Reuters,Spanish family of four missing after boat sinks off Indonesia,https://www.reuters.com/world/asia-pacific/spanish-family-missing-after-boat-sinks-off-indonesia-2025-12-27/,
2025-12-27T17:25:11Z,People.com,Soccer Coach and His 3 Young Children Die After Boat Sinks Near Popular Tourist Destination,https://people.com/soccer-coach-his-3-young-children-die-after-boat-sinks-near-tourist-destination-11876604,Kimberlee Speakman
2025-12-28T00:04:52Z,BBC,The Ashes: MCG curator Matthew Fox in 'state of shock' over two-day Test,https://www.bbc.com/sport/cricket/articles/ckgkd2gzq4xo,Stephan Shemilt
2025-12-28T03:15:59Z,News.com.au,'There'd be hell': Australia hypocrisy exposed,https://www.news.com.au/sport/cricket/thered-be-hell-australian-called-out-for-cricket-hypocrisy/news-story/aff5a5af0016de725851227cf6267a6f,Tyson Otto
2025-12-27T17:29:00Z,The Guardian,England's MCG triumph is a genuine coup - and a picture of what might have been | Barney Ronay,https://www.theguardian.com/sport/2025/dec/27/englands-mcg-triumph-is-a-genuine-coup-and-a-picture-of-what-might-have-been,Barney Ronay
2025-12-28T01:03:00Z,ESPNcricinfo,MCG curator in 'state of shock' as Head offers support after costly two-day finish,https://www.espncricinfo.com/story/mcg-curator-in-state-of-shock-as-travis-head-offers-support-after-costly-two-day-finish-1517332,Matt Roller
2025-12-28T01:21:00Z,The Guardian,Myanmar elections: voting begins under junta stranglehold with Aung San Suu Kyi banned,https://www.theguardian.com/world/2025/dec/28/myanmar-elections-voting-begins-under-junta-stranglehold-with-aung-san-suu-kyi-banned,Khant Si
2025-12-27T10:01:00Z,NPR,Myanmar is set to hold phased elections. Here's why they're being called a 'sham',https://www.npr.org/2025/12/27/nx-s1-5649519/myanmar-election,Michael J. Sullivan
2025-12-27T23:02:52Z,BBC,War-torn Myanmar voting in widely criticised 'sham' election,https://www.bbc.com/news/articles/cy7vly6gm76o,Kelly Ng
2025-12-27T23:31:13Z,CNN,Myanmar's military junta holds elections as civil war sparked by coup still rages,https://www.cnn.com/2025/12/27/asia/myanmar-election-civil-war-hnk-intl,"Ross Adkin, Dan Hodge & Ivan Watson"
