Date,Website,Title,URL,Author
2025-12-27T20:26:00Z,USA Today,"Large earthquake rocks Taiwan, felt in Taipei",https://www.usatoday.com/story/news/world/2025/12/27/taiwan-earthquake-december-27/87926963007/,Jeanine Santucci
2025-12-27T20:35:27Z,CNN,"Taiwan rattled by 7.0 magnitude quake, no major damage reported",https://www.cnn.com/2025/12/27/asia/taiwan-earthquake-tremors-intl-latam,
2025-12-27T20:35:56Z,DW,7.0-magnitude earthquake rattles Taiwan,https://www.dw.com/en/70-magnitude-earthquake-rattles-taiwan/a-75317087,Nik Martin
2025-12-27T16:00:13Z,Reuters,TSMC says some facilities evacuated after quake,https://www.reuters.com/world/asia-pacific/tsmc-says-some-facilities-evacuated-after-quake-2025-12-27/,Ben Blanchard
2025-12-27T00:57:52Z,BBC,Guinea and Central African Republic elections: Leaders aim to consolidate power at in two polls in Africa,https://www.bbc.com/news/articles/cpwk9grv290o,Paul Melly
2025-12-27T05:37:30Z,Al Jazeera,Central African Republic election: Who's running and what's at stake?,https://www.aljazeera.com/news/2025/12/27/central-african-republic-election-whos-running-and-whats-at-stake,Shola Lawal
2025-12-28T00:13:41Z,U.S. News & World Report,"Central African Republic Votes, Russia Ally Touadera Seeks Third Term",https://www.usnews.com/news/world/articles/2025-12-27/central-african-republic-votes-russia-ally-touadera-seeks-third-term,"Pacome Pabandji, Hugh Lawson & Robbie Corey-Boulet"
2025-12-28T03:56:00Z,Yahoo,Touadera on path to third presidential term as Central African Republic votes,https://www.yahoo.com/news/articles/touadera-path-third-presidential-term-035653055.html,Cécile Brajeul
2025-12-27T21:12:44Z,Politico,"Iran at war with the West and Israel, says Iran's president",https://www.politico.com/news/2025/12/27/iran-war-israel-trump-00706976,Gregory Svirnovskiy
2025-12-27T17:58:00Z,AP News,Iran's president says his country is in a full-scale war with the West,https://apnews.com/article/iran-president-war-west-trump-netanyahu-2ef7a55988b80813f6913c8c1835322b,
2025-12-28T02:58:39Z,Fox News,"Iranian president says his country is at 'total war' with the US, Israel and Europe: reports",https://www.foxnews.com/world/iranian-president-says-country-total-war-us-israel-europe,Sophia Compton
2025-12-28T03:07:00Z,The Hill,"Iran's president says country is in 'full-scale war' with US, Israel, Europe",https://thehill.com/policy/international/5664503-iran-president-war-us-israel-europe/,Ashleigh Fields
2025-12-27T15:14:00Z,AP News,Saudi-led coalition in Yemen warns United Arab Emirates-backed separatists of immediate action,https://apnews.com/article/yemen-separatists-uae-saudi-arabia-ea218eb8e2ab266474b6c7018268da00,Ismaeel Naar & Adam Rasgon
2025-12-27T16:04:54Z,The New York Times,"Saudi-Led Group in Yemen Tells Separatists to Withdraw, or Be 'Dealt With'",https://www.nytimes.com/2025/12/27/world/middleeast/yemen-saudi-arabia-airstrikes.html,Ismaeel Naar & Adam Rasgon
2025-12-27T08:18:45Z,Reuters,Yemen's Saudi-led coalition warns STC against moves in Hadramout,https://www.reuters.com/world/middle-east/yemens-saudi-led-coalition-says-it-will-deal-with-military-moves-hadramout-2025-12-27/,
2025-12-27T15:59:00Z,AP News,Hundreds mourn in Syria's Homs after deadly mosque bombing,https://apnews.com/article/syria-homs-mosque-bomb-alawite-28c05d4c1f3178a3336a3c2d41a4d60e,Eyad Kourdi
2025-12-26T15:01:16Z,BBC,Homs: Deadly explosion during Friday prayers inside Syrian mosque,https://www.bbc.com/news/articles/cx25387dj8no,Tiffany Wertheimer
2025-12-26T21:00:56Z,UN News,Syria: Guterres deplores deadly mosque blast in Homs,https://news.un.org/en/story/2025/12/1166674,
2025-12-27T04:13:30Z,The New York Times,Thailand and Cambodia Reach Cease-Fire in Brutal Border War,https://www.nytimes.com/2025/12/26/world/asia/thailand-cambodia-cease-fire-border-war.html,Sui-lee Wee
2025-12-26T12:18:26Z,BBC,Thailand bombs Cambodian border area as ceasefire talks continue,https://www.bbc.com/news/articles/c4gk15x85jlo,Raffi Berg
2025-12-27T04:26:00Z,Reuters,Thailand and Cambodia sign truce to halt fierce border conflict,https://www.reuters.com/world/asia-pacific/thailand-cambodia-sign-ceasefire-agreement-cambodian-defence-ministry-says-2025-12-27/,William Mallard & Devjyot Ghoshal
2025-12-26T23:49:29Z,BBC,Two killed in suspected Palestinian ramming and knife attack in Israel,https://www.bbc.com/news/articles/c9d9znp22pyo,Raffi Berg
2025-12-26T12:13:13Z,CNN,"Two Israelis killed in Palestinian car-ramming and stabbing attack, police say",https://www.cnn.com/2025/12/26/middleeast/israel-ramming-knife-attack-palestinian-suspect-intl,Dana Karni & Tal Shalev
2025-12-26T18:11:00Z,The Guardian,Two killed in stabbing and suspected car-ramming in northern Israel,https://www.theguardian.com/world/2025/dec/26/palestinian-man-kills-two-in-northern-israel-car-ramming-and-stabbing-attack-police-say,
2025-12-26T21:20:00Z,AP News,A Palestinian man kills 2 in car-ramming and stabbing attack in northern Israel and injures 2 others,https://apnews.com/article/israel-palestinians-stabbing-ramming-militant-attack-war-e80f99771c1586529bcddf9bb24a2eb8,Julia Frankel
2025-12-27T00:23:51Z,The Washington Post,Explosion at mosque in Syria's Homs kills at least eight people,https://www.washingtonpost.com/world/2025/12/26/syria-mosque-explosion-homs/,Kareem Fahim & Suzan Haidamous
2025-12-26T15:01:16Z,BBC,Blast at Syrian mosque during Friday prayers leaves at least eight dead,https://www.bbc.com/news/articles/cx25387dj8no,Tiffany Wertheimer
2025-12-26T17:43:01Z,The New York Times,"8 Killed in Syria Mosque Blast, Government Says",https://www.nytimes.com/2025/12/26/world/middleeast/syria-homs-mosque-explosion.html,Hussam Hammoud & Abdi Dahir
2025-12-26T18:36:26Z,CNN,Israel becomes first country to formally recognize Somaliland as independent state,https://www.cnn.com/2025/12/26/africa/israel-recognizes-somaliland-latam-intl,
2025-12-26T21:44:42Z,BBC,"Israel recognises Somaliland as independent state, Netanyahu says",https://www.bbc.com/news/articles/c4g417md05go,Tom McArthur
2025-12-26T23:53:42Z,The Times of Israel,Trump says he won't join Israel's recognition: 'Does anyone know what Somaliland is?',https://www.timesofisrael.com/liveblog-december-27-2025/,
2025-12-27T03:51:41Z,The New York Times,What Went Wrong Before Hong Kong's Apartment Inferno,https://www.nytimes.com/2025/12/26/world/asia/hong-kong-apartment-fire-corruption.html,Selam Gebrekidan
2025-12-26T14:50:48Z,nhk.or.jp,Hong Kong tightens control as people mark one month since deadly high-rise fire,https://www3.nhk.or.jp/nhkworld/en/news/20251226_16/,
2025-12-26T00:30:07Z,South China Morning Post,"How Hong Kong's Tai Po community is finding light in darkness, 1 month after fire",https://www.scmp.com/news/hong-kong/society/article/3337743/quiet-strength-how-hong-kongs-tai-po-community-moving-1-month-after-fire,Fiona Sun
2025-12-26T00:30:00Z,Hong Kong Free Press,"'Place of heartbreak': One month since fatal fire, Wang Fuk Court residents reel from trauma, pondering their future",https://hongkongfp.com/2025/12/26/place-of-heartbreak-one-month-since-fatal-fire-wang-fuk-court-residents-reel-from-trauma-pondering-their-future/,Hans Tse & Kelly Ho
2025-12-27T01:44:00Z,AP News,At least 15 injured in a knife and chemical attack at a factory in Japan,https://apnews.com/article/japan-stabbing-knife-factory-27851c68d86437cf0e2f70dea5286988,
2025-12-26T14:29:28Z,Reuters,Southern Yemeni separatists dismiss Saudi call to withdraw from eastern provinces,https://www.reuters.com/world/middle-east/uae-welcomes-saudi-efforts-support-security-yemen-foreign-ministry-says-2025-12-26/,Andrew England
2025-12-27T05:00:35Z,Financial Times,Saudi strikes UAE-backed faction in Yemen as Gulf rift deepens,https://www.ft.com/content/9c3051a5-7f08-4555-b437-75527ad51d77,Andrew England
2025-12-26T14:55:00Z,The Guardian,Southern separatists in Yemen report Saudi airstrikes near positions,https://www.theguardian.com/world/2025/dec/26/southern-separatists-on-rise-in-yemen-report-saudi-airstrikes-near-positions,Patrick Wintour
2025-12-26T14:57:10Z,Euronews.com,Japan on track to become world's third-largest defence spender,https://www.euronews.com/business/2025/12/26/japan-on-track-to-become-worlds-third-largest-defence-spender,Megumi Fujikawa
2025-12-26T01:48:00Z,The Wall Street Journal,Japan Plans Record High Initial Budget for Next Fiscal Year,https://www.wsj.com/economy/japan-plans-record-high-initial-budget-for-next-fiscal-year-b81616cc,Megumi Fujikawa
2025-12-26T09:50:25Z,Bloomberg.com,Japan Sees First Primary Balance Surplus in 28 Years Next Year,https://www.bloomberg.com/news/articles/2025-12-26/japan-sees-first-primary-balance-surplus-in-28-years-next-year,Erica Yokoyama
2025-12-25T08:41:02Z,Reuters,Japan PM reassures markets with fiscal discipline in next year's budget,https://www.reuters.com/world/asia-pacific/japan-pm-stresses-fiscal-discipline-next-years-budget-with-lower-debt-reliance-2025-12-25/,Yoshifumi Takemoto & Makiko Yamazaki
2025-12-26T11:38:57Z,Al Jazeera,Malaysian ex-PM Najib Razak found guilty in 1MDB trial: What we know,https://www.aljazeera.com/economy/2025/12/26/malaysian-ex-pm-najib-razak-found-guilty-in-1mdb-trial-what-we-know,Sarah Shamim
2025-12-26T13:24:31Z,The New York Times,New Jail Term for Ex-Malaysian Leader Najib Razak in Corruption Scandal,https://www.nytimes.com/2025/12/26/world/asia/malaysia-najib-razak-corruption-sentence-1mdb.html,Zunaira Saieed
2025-12-26T07:58:46Z,CNN,Malaysia court finds jailed former leader Najib Razak guilty of abuse of power in biggest 1MDB trial,https://www.cnn.com/2025/12/26/asia/najib-1mdb-verdict-intl-hnk,
2025-12-26T14:15:36Z,BBC,1MDB: Ex-Malaysia PM Najib Razak given 15-year jail term over state funds scandal,https://www.bbc.com/news/articles/crk7y27vp1eo,
2025-12-27T00:35:00Z,Reuters,"Ukrainian capital Kyiv under massive Russian attack, officials say",https://www.reuters.com/world/europe/ukrainian-capital-kyiv-under-massive-russian-attack-officials-say-2025-12-27/,Raju Gopalakrishnan & Ron Popeski
2025-12-27T04:21:43Z,Reuters,"Russian drones, missiles pound Ukraine before Zelenskiy-Trump meeting",https://www.reuters.com/world/europe/russian-drones-missiles-pound-ukraine-before-zelenskiy-trump-meeting-2025-12-27/,
2025-12-25T12:12:16Z,ABC News,Death toll rises after Ukraine reports Russian drone strikes,https://abcnews.go.com/International/ukraine-reports-deadly-russian-drone-strikes-christmas-morning/story?id=128690492,David Brennan & Nadine El-Bawab
2025-12-23T15:58:23Z,CNN,"'Massive' Russian attack on Ukraine kills 4-year-old child, as Zelensky is briefed on peace talks",https://www.cnn.com/2025/12/23/europe/russian-attack-zelensky-ukraine-talks-intl,Billy Stockwell


